<?xml version="1.0" encoding="UTF-8"?>
<FT12sim:sequences xmlns:FT12sim="http://www.freebus.org/FT12sim" xmlns:xsi="http://www.w3.org/2001/XMLSchema-instance" xsi:schemaLocation="http://www.freebus.org/FT12sim FT12sim.xsd ">
  <FT12sim:sequence>
    <FT12sim:Discription>FT12sim:Discription</FT12sim:Discription>
    <FT12sim:resieve>
      <FT12sim:Telegram>AD</FT12sim:Telegram>
    </FT12sim:resieve>
    <FT12sim:transmitframes>
      <FT12sim:frame>
        <FT12sim:Telegram>AC</FT12sim:Telegram>
      </FT12sim:frame>
    </FT12sim:transmitframes>
  </FT12sim:sequence>
  <FT12sim:sequence>
  	<FT12sim:Discription>FT12sim:Discription</FT12sim:Discription>
  	<FT12sim:resieve>
  		<FT12sim:Telegram>AA</FT12sim:Telegram>
  	</FT12sim:resieve>
  	<FT12sim:transmitframes>
  		<FT12sim:frame>
  			<FT12sim:Telegram>A</FT12sim:Telegram>
  		</FT12sim:frame>
  		<FT12sim:frame>
  			<FT12sim:Telegram>A</FT12sim:Telegram>
  		</FT12sim:frame>
  		<FT12sim:frame>
  			<FT12sim:Telegram>A</FT12sim:Telegram>
  		</FT12sim:frame>
  		<FT12sim:frame>
  			<FT12sim:Telegram>A</FT12sim:Telegram>
  		</FT12sim:frame>
  	</FT12sim:transmitframes>
  </FT12sim:sequence>
</FT12sim:sequences>
